{
  "schemaVersion": "0.1.0",
  "id": "stream-task",
  "title": "同步任务-流任务",
  "stage": "checked",
  "mode": "module",
  "objective": "验证第二类真实 PRD 能否沿用 Sens 原型工作流，形成流任务从创建、提交、运行、暂停、编辑到再次运行的可评审闭环。",
  "sources": [
    {
      "id": "source-prd-v3",
      "kind": "prd",
      "location": "input/stream-task-prd.md",
      "usage": "业务目标、P0/P1 范围、页面、字段、状态机、校验、配额、权限与兼容要求。"
    },
    {
      "id": "source-sens-kit",
      "kind": "sens_rule",
      "location": "../../vendor/sens-prototype-kit-0.1.0-p0.6.tgz#catalog.json",
      "usage": "固定版本 Sens 公开组件、Product Shell、规则来源与已知限制。"
    },
    {
      "id": "source-figma-side-navigation-groups",
      "kind": "figma",
      "location": "https://www.figma.com/design/IBBF40Lst6uPPJf70pi0bh?node-id=18596-105388",
      "usage": "SensD 产品壳侧导航二级分组默认展开、独立收起/展开、箭头状态和层级间距规则；页面直接复用 ProductShellSideNavigation，不在业务层重写样式或交互。"
    },
    {
      "id": "source-p1-scope-confirmation",
      "kind": "user_decision",
      "location": "conversation:2026-09-20-p1-scope-confirmation",
      "usage": "确认 P1 分阶段推进、首轮核心闭环和首批 intake 规格；锚点方位后续以 Figma 右侧布局为准。"
    },
    {
      "id": "source-figma-stream-task",
      "kind": "figma",
      "location": "https://www.figma.com/design/hnP4ZsKaolTW5u4Tof38zV/SDH-1.3.6-%E7%89%88%E6%9C%AC-%E6%95%B0%E6%8D%AE%E6%8E%A5%E5%85%A5?node-id=687-86836",
      "usage": "13 个用户指定节点的创建、来源联动、报警、详情、编辑状态和 Kafka/Hive 资产。"
    },
    {
      "id": "source-user-flow-evidence",
      "kind": "user_decision",
      "location": "user-provided:process-video-and-two-reference-screens",
      "usage": "确认列表入口、创建页整体布局及来源选择、映射、执行规则和数据预览的操作顺序。"
    },
    {
      "id": "source-p1b-confirmation",
      "kind": "user_decision",
      "location": "conversation:2026-09-20-p1b-implementation-confirmation",
      "usage": "确认按已展示的 P1-B 范围和文件清单实现。"
    },
    {
      "id": "source-designer-layout-actions-feedback",
      "kind": "user_decision",
      "location": "conversation:2026-09-21-layout-anchor-table-actions-confirmation",
      "usage": "确认窄于 1280px 时保持桌面最小宽度与 24px 页面留白、锚点消费 14/22 正式文字规格、表格操作超过三个时收进更多，并在当前页面修正更多箭头与 Hash 字段内容的中心线对齐。"
    },
    {
      "id": "source-figma-small-confirm",
      "kind": "figma",
      "location": "https://www.figma.com/design/IBBF40Lst6uPPJf70pi0bh?node-id=6483-34744,6483-34773,6483-34802,6483-34831",
      "usage": "小型二次确认的上、下、左、右四种展开方向共用 24px 高、12/18 文字、10px 横向内边距、12px 按钮间距和 3px 圆角的小按钮规格。"
    },
    {
      "id": "source-designer-tab-rhythm-feedback",
      "kind": "user_decision",
      "location": "conversation:2026-09-21-list-tab-rhythm-confirmation",
      "usage": "确认列表页正式标题栏保持不变，Tab 行改用 SensD 40px 高度档、正文 14/22 文字规格和垂直居中布局。"
    },
    {
      "id": "source-designer-list-filter-status-feedback",
      "kind": "user_decision",
      "location": "conversation:2026-09-21-list-filter-status-confirmation",
      "usage": "确认任务状态圆点改用 SensD 状态语义色，搜索框恢复 200px 默认宽度，并锁定选择器正文为 14/22。"
    },
    {
      "id": "source-designer-detail-popover-feedback",
      "kind": "user_decision",
      "location": "conversation:2026-09-22-detail-popover-major-feedback",
      "usage": "确认删除确认浮层箭头必须指向更多按钮；详情页正文标题、正文、卡片高度、映射图标、带背景只读输入、右侧锚点和标题栏操作需按 Sens 正式规则修正。"
    },
    {
      "id": "source-designer-detail-spacing-feedback",
      "kind": "user_decision",
      "location": "conversation:2026-09-22-detail-spacing-major-feedback",
      "usage": "确认详情卡片统一使用 16px 内边距；基础信息和执行规则采用单列就近关系，描述与任务状态间距 20px，规则标题与对应内容卡片间距 8px；来源与目标卡片顶对齐；报警圆点使用状态色，状态行、灰色标题和卡片外框左对齐，报警条件拆分为标题列与内容列，状态行到卡片使用 Sens 既有 12px 间距。"
    }
  ],
  "scope": {
    "change": [
      "新增流任务列表及配额、状态和任务操作的原型规格。",
      "新增创建同步任务的单页四区配置流程规格。",
      "新增任务详情、暂停后编辑和复制任务页面规格。",
      "定义等待运行、运行中、运行异常、已暂停的任务状态转换。",
      "定义成功、失败、配额耗尽和权限受限的可重复模拟场景。",
      "补充桌面最小宽度、页面留白、右侧锚点文字和表格操作收纳规则。",
      "补充表格更多箭头与 Hash 字段内容的中心线对齐规则。",
      "补充小型二次确认的小按钮规格、列表 Tab 通栏分割线及 40px Tab 垂直节奏。",
      "补充列表任务状态色、200px 搜索框和 14/22 选择器文字规格。",
      "补充删除确认浮层与实际触发按钮的锚定规则，以及详情页正文层级、只读输入、映射图标、右侧锚点和标题栏操作规则。",
      "恢复 SensD 侧边导航基础组件的二级分组展开/收起能力，保持当前四组默认展开。"
    ],
    "preserve": [
      "使用固定版本 @sens/prototype-kit，不引用相邻 sens-preview 源码。",
      "保持 Sens Product Shell 的顶导、侧导、标题栏和内容滚动结构。",
      "设计审核状态仅依据设计师明确决定更新，不以 Agent 自查替代签字。"
    ],
    "excluded": [
      "真实 Kafka、Schema、任务调度、权限、Licence 和操作日志服务。",
      "运行记录页面的完整内容与运行日志详情。",
      "真实数据预览服务、P5 快捷筛选和列目设置。",
      "上游 sens-preview 组件或规则修改。",
      "国际化文案实现、真实文件下载和真实外部数据连接详情页。"
    ]
  },
  "requirements": [
    {
      "id": "req-list-entry",
      "description": "数据同步页面提供流任务 Tab 和创建任务入口；无数据时展示可引导创建的空态。",
      "basis": "explicit",
      "sourceRefs": ["source-prd-v3"]
    },
    {
      "id": "req-side-navigation-groups",
      "description": "列表页直接使用 SensD ProductShellSideNavigation 的二级分组能力；四个分组默认展开并显示组件内置箭头，点击分组标题可独立收起或展开子项，不在业务层关闭或重写该交互。",
      "basis": "confirmed",
      "sourceRefs": ["source-figma-side-navigation-groups", "source-sens-kit"]
    },
    {
      "id": "req-list-quota",
      "description": "列表显示总条数及运行中数量与总配额，默认总配额为 3；配额用尽时运行操作禁用并提示原因。",
      "basis": "explicit",
      "sourceRefs": ["source-prd-v3"]
    },
    {
      "id": "req-list-status",
      "description": "任务支持等待运行、运行中、运行中异常和已暂停状态；列表默认按任务 ID 降序展示；状态圆点依次使用 SensD processing、success、warning 和 invalid 语义色。",
      "basis": "confirmed",
      "sourceRefs": ["source-prd-v3", "source-designer-list-filter-status-feedback", "source-sens-kit"]
    },
    {
      "id": "req-list-filter-style",
      "description": "列表搜索使用 Sens Search 默认 200px 固定宽度；任务状态选择器文字使用正文 14px 字号和 22px 行高。",
      "basis": "confirmed",
      "sourceRefs": ["source-designer-list-filter-status-feedback", "source-sens-kit"]
    },
    {
      "id": "req-list-actions",
      "description": "列表支持查看、运行或暂停、编辑、复制和删除；运行中禁止编辑与删除，已暂停允许编辑与删除。",
      "basis": "explicit",
      "sourceRefs": ["source-prd-v3"]
    },
    {
      "id": "req-list-action-overflow",
      "description": "表格操作列最多展示查看、运行或暂停和更多三个入口；编辑、复制和删除收进更多，删除不在操作列外部单独展示。",
      "basis": "confirmed",
      "sourceRefs": ["source-designer-layout-actions-feedback", "source-sens-kit"]
    },
    {
      "id": "req-list-tab-divider",
      "description": "列表页 Tab 下方的分割线贯穿整个标题区，并延伸到右侧 Schema 配置和创建任务按钮下方。",
      "basis": "confirmed",
      "sourceRefs": ["source-designer-layout-actions-feedback", "source-sens-kit"]
    },
    {
      "id": "req-list-tab-rhythm",
      "description": "列表页保持正式 Sens 标题栏；其下 Tab 使用 40px 高度档、14px 字号、22px 行高和垂直居中布局，不叠加额外顶部内边距。",
      "basis": "confirmed",
      "sourceRefs": ["source-designer-tab-rhythm-feedback", "source-sens-kit"]
    },
    {
      "id": "req-small-confirm-actions",
      "description": "size=small 的二次确认使用 Sens 小按钮；当前列表删除确认与表单放弃确认的操作按钮为 24px 高、12px 字号。",
      "basis": "confirmed",
      "sourceRefs": ["source-figma-small-confirm", "source-sens-kit"]
    },
    {
      "id": "req-delete-confirm-anchor",
      "description": "列表删除确认 Popover 的定位触发区域与更多按钮完全重合，浮层箭头指向更多按钮的视觉中心线。",
      "basis": "confirmed",
      "sourceRefs": ["source-designer-detail-popover-feedback", "source-figma-small-confirm", "source-sens-kit"]
    },
    {
      "id": "req-local-alignment",
      "description": "表格操作列的更多文字与箭头保持同一视觉中心线；Hash 字段标题、标签和添加链接保持同一中心线。",
      "basis": "confirmed",
      "sourceRefs": ["source-designer-layout-actions-feedback", "source-sens-kit"]
    },
    {
      "id": "req-desktop-min-width",
      "description": "浏览器窄于 1280px 时保留 1280px 桌面页面结构并由横向滚动承接，列表、创建和详情页左右留白保持 24px，不随视口压缩。",
      "basis": "confirmed",
      "sourceRefs": ["source-designer-layout-actions-feedback", "source-sens-kit"]
    },
    {
      "id": "req-create-layout",
      "description": "创建页采用单页纵向表单与右侧四项锚点导航，包含任务基础信息、数据来源和目标、任务执行规则、报警监控。",
      "basis": "confirmed",
      "sourceRefs": ["source-prd-v3", "source-figma-stream-task", "source-user-flow-evidence", "source-p1b-confirmation"]
    },
    {
      "id": "req-create-anchor-typography",
      "description": "创建页右侧锚点保持桌面右栏布局，文字消费 Sens 14px / 22px 正文规格；默认 regular，选中项使用强调字重与品牌色。",
      "basis": "confirmed",
      "sourceRefs": ["source-designer-layout-actions-feedback", "source-sens-kit"]
    },
    {
      "id": "req-basic-info",
      "description": "任务名称必填、最多 100 个字符且仅支持字母、数字、下划线和中文；描述最多 200 个字符。",
      "basis": "explicit",
      "sourceRefs": ["source-prd-v3"]
    },
    {
      "id": "req-source-linkage",
      "description": "来源连接仅展示消息队列类型；选择正常连接后解禁并过滤来源数据，半结构化来源进一步显示并过滤 Schema。",
      "basis": "explicit",
      "sourceRefs": ["source-prd-v3"]
    },
    {
      "id": "req-source-exception",
      "description": "异常来源连接显示错误反馈与查看详情入口，并保持来源数据禁用。",
      "basis": "explicit",
      "sourceRefs": ["source-prd-v3"]
    },
    {
      "id": "req-target-mapping",
      "description": "目标类型默认实体，目标数据可选择用户表、事件表或明细表；非神策标准 JSON 来源需要配置字段映射。",
      "basis": "explicit",
      "sourceRefs": ["source-prd-v3"]
    },
    {
      "id": "req-standard-json",
      "description": "神策标准 JSON 来源显示标识，并提示无需配置同步目标和字段映射。",
      "basis": "explicit",
      "sourceRefs": ["source-prd-v3"]
    },
    {
      "id": "req-execution",
      "description": "任务长期有效、长期执行；首次消费起始支持最早、最新、时间戳和特定偏移量，读取逻辑固定为追加更新。",
      "basis": "explicit",
      "sourceRefs": ["source-prd-v3"]
    },
    {
      "id": "req-write-partition",
      "description": "写入逻辑随目标表类型只读展示；分区规则支持按并行度绑定或按有序字段 hash。",
      "basis": "explicit",
      "sourceRefs": ["source-prd-v3"]
    },
    {
      "id": "req-exception-advanced",
      "description": "用户可选择是否跳过异常数据；高级设置包含并行度、优化参数和允许在强校验下创建事件或属性。",
      "basis": "explicit",
      "sourceRefs": ["source-prd-v3"]
    },
    {
      "id": "req-alarm",
      "description": "报警默认开启；可分别配置重启次数和跳过异常数据次数两类条件，关闭时隐藏配置。",
      "basis": "confirmed",
      "sourceRefs": ["source-prd-v3", "source-figma-stream-task", "source-p1b-confirmation"]
    },
    {
      "id": "req-data-preview",
      "description": "选定来源数据和 Schema 后可打开数据预览抽屉，展示加载、无数据或模拟数据状态。",
      "basis": "confirmed",
      "sourceRefs": ["source-figma-stream-task", "source-user-flow-evidence", "source-p1b-confirmation"]
    },
    {
      "id": "req-submit-state",